{
    "application": "4fe9492c-1d19-4e6b-be72-03208789906e",
    "boundedContext": "4a5d2bc3-543f-459a-ab0b-e8e924093260",
    "boundedContextName": "[Not Set]",
    "resources": {
        "eventStore": {
            "production": "MongoDB",
            "development": "MongoDB"
        },
        "projections": {
            "production": "MongoDB",
            "development": "MongoDB"
        },
        "embeddings": {
            "production": "MongoDB",
            "development": "MongoDB"
        },
        "readModels": {
            "production": "MongoDB",
            "development": "MongoDB"
        }
    },
    "core": {
        "language": "csharp"
    },
    "interaction": []
}
